review_text,review_status
"It's always easy to criticize somebody's personal choises when it comes to the movies and the stars, but this book is dedicated to the most unforgettable ACTRESSES and not STARS of the studio era. So it comes pretty natural to ask : Is Esther Williams such an unforgettable actress that the author had to overlook Margaret Sullavan? Was Grace Kelly's talent so overwhelming to forget that Miriam Hopkins had such an individuality in the acting process that she kept on working with such directors as Lubitsch, Wyler, Mamoulian, Hawks and Vidor to stunning results? What was wrong with Mary Astor's acting and what is right with Kim Novak's ?",negative
"This book was recommended by someone a lot more financially successful than I am. But while I was reading, I kept asking myself, ""When's he going to get to the point?"" The first part of the book is all about why it's good to be rich--something I thought was unnecessary. The bulk of the book is filled with anecdotes that try to illustrate the different mindset of rich people as compared to middle-class and poor. Finally, in the last part of the book, he gives some practical examples of what he considers to be good investment strategy. This was the only part of the book I was interested in. To me, it was like his publicist told him that no one is going to buy a 30-page book on investing and so Kiyosaki wrote what he knew about making money and filled the rest with ""fluff"". However, even his advice is considered questionable by many experts. I would say that the main idea I got from this book was to try to look at investing from different angles and not to just follow the crowd. I just wish I hadn't invested so much time in a book that could have been a lot more concise",negative
"In 1980 Michael Weiner saw the publication of Weiner's Herbal: The Guide to Herb Medicine, which states the medical benefits of marijuana [7]. However he recently stated that the chemicals in marijuana make it too dangerous to be used as medicine. On his program, he strongly cautions against the recreational use of marijuana, occasionally devoting his show to ""marijuana horror stories"" and its claimed potential to ruin lives. He has authored a number of other books on various herbal medicine topics under this name. More recently, Savage's books are political in nature and published by WND Books, a partnership between the conservative website WorldNetDaily and Thomas Nelson, a publisher of Christian books.",negative
I purchased this took and then found that it was just a reprint from several decades ag,negative
"Am I the only one who didn't get a complete book? At first I noticed there was some poor editing - lots of typos. But then after page 180, where page 181 should be (Sleep chapter), it goes back to page 117 (Discipline chapter that I already read). It continues to repeat pages 117 to 180 (a whole 63 pages duplicated!), then picks up again on page 245 in the middle of the School Days chapter that I don't have the beginning of. I'm completely missing pages 181-245 (67 pages).",negative
"I thought this book would be great and was really looking forward to making some of the recipes, but I have to admit I'm disappointed with the recipes and with what I've baked from it so far. I was surprised that so many of the recipes called for vegetable shortening instead of or in addition to butter. I know the book itself explains that shortening is used to achieve a certain texture, but I have read in other baking books that shortening is a crutch and doesn't deliver the flavor punch of pure butter.",negative
What a complete and utter waste of time. Its obvious how these guys got dubbed the nutroots,negative
ive read many endtimes outlines. tcp isnt any good. go to fortbethel.com under books for much better guides. tcp put me to sleep,negative
This is a book meant to be enjoyed by children under the age of 10. Young teens and adult readers will be disapointed. Wish I never wasted the time of day reading it. Glad it was borrowed from the library and not purchased or I'd demand my money back,negative
"Very poor book, realy a waste of time. The review below said it all",negative
"The book is obviously well-researched and the chapter on The Riders was interesting. However, the author included a lot of details that just really didn't matter-as if he threw in the entire contents of his research rather than sifting out the relevant facts. The photos and illustrations that he used were illuminating and contributed to the educational value of the book.",negative
Ed Klein is really so desperate in his attack that he can't find any one person who will use their names in the attacks against Hillary!,negative
"The topic of this book is very interesting: espionage in the Revolutionary War. Unfortunately, ""Washington's Spies"" goes into so much nit-picking detail that, as the cliche goes, you can't see the forest for the trees. To really get anything out of this book, you'd have to be a *very* dedicated Revolutionary War buff. It didn't have much appeal at all to me as a general reader.",negative
"There is no doubt that Antonia Fraser's ""The Journey"" is written in the author's usual wry, witty and highly engaging style (although I must say that I never before heard of sex described as ""lugubrious."") There is also no doubt that Fraser has done a great deal to redeem Marie-Antoinette's shredded reputation by accurately describing her as being compassionate to the hardships of the French people. The book is full of vivid detail which makes it very readable. However, I was disappointed to see that Fraser resorts to many popular misconceptions. For one thing, why does Fraser act like Marie Antoinette was the only princess to be sent away from home as a teenager to seal a dynastic marriage? What about Sophie of Anhalt-Zerbst (Catherine the Great) who was also a young stranger in a foreign land? This sort of thing happened all the time - it was what being a princess was all about. I was glad that Fraser did not fall into the myth of Louis XVI's impotence/ phimosis and surgery and all that. She simplistically portrays him as being asexual, which was not true, because he told his aunt after consummating his marriage that he enjoyed ""it."" But never has any other biographer subjected the reader to the spectacle of Fersen and the queen fiddling with primitive prophylactics while consummating their grand passion. I must say, it is a first. Fraser insists that Marie Antoinette slept with Fersen for many years and yet gives no solid proof, while at the same time maintaining that she was a woman of high moral character. I usually do not think of a woman who is shared by both a lover and a husband as having a high moral character, but I guess Fraser does. Oh, well. It is such romantic fantasies that turn this book into more of a soap opera than a serious biography. I found it absurd when Fraser insists that the tormented queen of France was ultimately a martyr for the cause of the socialism and democracy which the French people now enjoy. If the queen had had her way, her descendant would be reigning today, and that is just the reality of it. For a better study of Marie Antoinette's relationship with her husband, I would recommend Vincent Cronin's ""Louis and Antoinette."" As for better biographies of the queen, let me join some fellow reviewers in the hope that the works of Delorme and Bertieres will soon be available in English",negative
"You get your money's worth here--there are a ton of CDs in this audio book. Unfortunately, I found Bryson's prose (which I enjoyed a lot when reading silently, as I have done with his other books) to be greatly irritating when spoken aloud. To me, he sounds kind of 'affected' in parts, and sometimes there is a sort of ""moist"" sound when he pronounces words. Hard to describe until you hear the CD, but trust me on this one. I think a lot of the positive reviews on here are for the book, and not the CD. I would stick with the written word on this one.",negative
"I picked this up because it's considered a classic and I knew it had been made into a movie. I tend to think that if a book is made into a movie, then the book must be pretty good. Not so with Howard's End. The plot in Howard's End doesn't progress much outside of an early death and later marraige. You have to have some interest in the characters, but they just weren't very believeable. None of characters convinced me that they could be people from the real world. I kept waiting for someone to say anything that might border on being interesting, but everyone babbles on and on about nothing of any substance. The story is clearly dated and doesn't hold up well so many years later. Living in today's world, it's hard to understand what attracted Margaret to Henry. There definately is an audience for this book. I'm just not a part of it",negative
"I'll start with the positive: The main character is a classic hero in every sense of the word - tall, good-looking, smart, humble, etc. The story was engaging and made for a quick read because it was easy to follow, carried the reader along and crafted as to have no wasted words. In short, it was a competent work of fiction.",negative
"I truly wanted to like this book. After years of avoidance I had just finished Moby Dick and found it not only more readable than I'd feared but downright enjoyable. In addition I'd heard nothing but good things about this novel whose premise certainly intrigued me, and like its predecessor it has one of the truly great opening lines in literature: ""Captain Ahab was neither my first husband nor my last."" Alas, it was all down hill from there; overall this is one of the worst books I've ever forced myself to finish.",negative
"I personally do not see how this book could have won a Newbery medal. While the author portrays sibling rivalry effectively, that is about the only positive aspect of this book. The fact that the teenage girl protagonist has a crush on an elderly man is disgusting and is presented as not only being acceptable but understandable. Sara's family is also unsupportive to her sulky and jealous attitudes. Her grandmother is a busybody and consantly antagonizes the family. Sara's twin sister gets all the attention and love, leaving Sara starving for parental care. Finally, Christianity is portrayed as harsh and judgemental. This book could possibly be acceptable for adults but never for children and I would not recommend it to anyone. I wasted my time with this book: please don't waste yours.",negative
This is another piece of lowbrow anti-German propaganda dressed as historiography.,negative
"Alright, for those of you who say Rand is criticizing works for false ideals, or lacking in substance, I say this: who is Rand to say what the absolute greatest ideals are? Who is Rand to say what substance is? You've got to look at her bias, first. Realize that Rand never takes into account anything not related to personal freedom. As if outside factors never matter; and maybe they don't, for her. Maybe her life in an oppressive Russia did nothing to form who she is today. But I doubt it.",negative
"A book full of heartwarming stories from country stars, singers, writers, and listeners, or so the back of the book said. As I read some sentimental stories, and some down right boring stories I questioned how more than half of these stories got into the `Country1 edition of the Chicken Soup series. I loved about three stories, liked about ten, and was puzzled by all the other entries",negative
I have a hard time believing that the author has ever seen an episode of TNG. I had to force myself to finish this book it was so bad. By far the worst Star Trek book I have ever read. If you want a good one read 'Federation' and stay as far away from this one as you can,negative
"I was so upset after I finished reading this book. I wish it wasn't updated and they just kept it in its original version. If you are looking for a historical information of how the samurai lived and their values, this is the wrong book. Read Bushido: The Soul of Japan. The Code of The Samurai really felt like The Code of the Japanese Business Man",negative
"I'll be blunt. I didn't care for this book. I bought it thinking it would delve into the subject of the Gnostic Sophia. Instead the author goes this way and that and hardly even mentions Her. I really think the title was misleading. As a sidenote, Lucifer is given a bad rap in this book and many concede that Lucifer plays an important part in later understandings of Gnosis",negative
"This book bears litthe relevance to the 'original' fourth edition book of the same name. There is no coordination with the text. Most of the concepts are explained in terms of economics not computer science, I have to wonder if the whole idea is a gross mistake or a scam. I feel cheated",negative
"This book was fun to look at, but not really usable. Lots of stylized drawings and self-aggrandizing tales by the author and not a lot of realistic how-to. Also, the explanations about skin care were clearly not written by anyone with a science or medical background.",negative
"For years, I had heard the Akashic Records being touted as the unwritten spiritual book of life, that included every event, every living soul who had ever taken a breath from the beginning of time through eternity. The subject was beyond fascinating, as my limited mortal mind could not grasp the enormity of such a body of knowledge ""existing"".",negative
"What is remarkable about this onetime best-selling book -- which could well be described as a coming-of-age-without-coming-of-age novel -- is not that Fitzgerald produced it when he was all of 24. Nope, the amazing thing here is that the same writer produced ""The Great Gatsby"" a mere five years later.",negative
"In the chapter about South Asia, the authors have written quite a lot about the &quot;Kashmir problem&quot; but not once have they mentioned the ethnic cleasing of 350,000 Kashmiri Hindus that took place in 1990. I just cannot believe that they don't know about this",negative
"I was hoping the book would be good. most reviews are. However the topics are not really covered at all, more introduced. It was like talking to a drunk bloke about sports, most points are important and relevant but its presented in a way that makes it confusing. They openly admit they dont want the book to be rated on the quality of the english. Just as well, long rambling thaughts that don't form conclusions. Not what I wanted or needed. It actually manages to take the fun out of reading and texas holdem all in one go",negative
"I enjoy reading sports fiction with my 10 year old son. The descriptions of this book suggested it addressed important themes which transcended basketball. However, as I read the book, I found the treatment of those themes quite superficial. In addition the book was bawdy. While it may accurately reflect locker room mentality, many readers may not find that mentality entertaining. It is not an appropriate book for children",negative
"I bought this recording with high hopes. What better complement to reading Shakespeare than hearing him, right? Well, not with this recording. The cast is made up of &quot;distinguished actors,&quot; the insert proclaims, but it's obvious that these actors haven't done Shakespeare since they were in junior high school. Nor have they improved since then: none of the actors has any feel for the Shakespearean line. The speaking is stiff and mechanical, and half the time it sounds like a Monty Python farce! When there are no visual effects to distract us, low-quality acting really sticks out. For audio recordings, you need the best voices. Too bad Arkangel didn't realize this. My advice? Grind up these CDs and use them to fertilize your nasturtiums",negative
"I don't really understand all the reviews about Sun Tzu's work. People saying that this one or that one is closer to the original; are there really that many experts in ancient Chinese out there. How can anyone say which is the best translation unless they are personally familiar with the original, in the original Chinese, and if that the case they should write their own version",negative
"In the commencement Mr. Utterson and his cousin Mr. Richard Enfield were walking throughout London. The men go by a mysterious cellar door, and then Mr. Enfield talked about a story that ensue here previously. Also later in the book Utterson work to help Dr. Jekyll from being brung into the ghastly tribulations of Mr. Hydes. One year later, Edward Hyde viciously murders Sir Danvers Carew by thrashing him to death with a cane.",negative
"I have listened to a bunch of Dean Koontz books. While listening to the second one I saw so many similarities, which really turned me off. And this flaw continued which each book I listen to, which caused me to be reluctant to buy this book. However, most of the stories were pretty good so I stuck with him. This is not the case with this book. ""Cold Fire"" is absolutely horrible. I so regret purchasing this book. It is so bad that I have decided to swear off Dean for looooooooong while.",negative
This book refers to philosophical basis of Buddhist practices as well as technical clasification of the states to be reached into meditative absortion. It is not a manual nor a guide. No Meditation techniques nor yoga excersises can be found on the book. the style is simbolic and poetical. it is an interesting book but the name does not reflect the content. It will be interesting for people more inclined to scholarly work,negative
I did not like the book Adam of the road because it tells you a whole bunch of stuff about the characters before it gets to the story and by the time you get to the story you forget about the characters. I also did not like the fact that the book talks weird and it says like thou father I shall bla bla bla,negative
"I read this book after watching the brilliant movie version of ""The Hours."" If that's your motivation, don't waste your time. My English teachers will cringe when I say it, but this book, well, sucks. It may well be great literature, but the characters are not engaging, and if it was Woolf's motive to out-do James Joyce in chronicling a day-in-the-life and in writing a stream of conscious narrative, she doesn't pull it off. Again, the characters and the internal mental life simply don't have the power that ""Ulysses"" has. Reading Woolf is necessary for a good eduction. I recommend, however, that you read ""To the Lighthouse"". I may still be motivated to read the book version of ""The Hours"" given how great the movie was. But my taste for Woolf is all done now.",negative
"This book is not about India or Indians. Shallow characters. Non existant plot. A dismal end to a not terrible beginning. Unlike one of the other reviewers, I was unlucky enough to buy this book - what a waste",negative
"I'm perhaps the only Steinbeck lover not to have yet read ""Grapes of Wrath"" or ""East of Eden."" Instead I have focused on ""Of Mice and Men"" and his lesser known works, such as ""To a God Unknown"" and, my personal favorite, ""Pastures of Heaven."" I've been enamored with his ability to vividly craft characters in particular.",negative
The instruction manual in EQ2 is quite addiquate regardless of class. Things you are not sure of are learned as you go or you can post on numerous forums for answers.,negative
"I couldn't finish this book after readng ""Fairytale."" Misfit insecure Caucasian male falls for Asian stripper/prostitute after she listens to him talk about the odor of his sweat in the outdoor markets. I thought possibly this story reveals a lot about Olen Butler. He wrote about this relationship with such relish, he sounds to me like a P.C. Caucasian who is drawn in patronizing fashion to the ""otherness"" of Asian people and doesn't see them for what they are, just wants them to appreciate big strong white man. I thought it interesting that in the story the woman never mentions to the man that she already has a young son living with her mother. So she was not honest with him. But Olen Butler wrote about her as if this stripper/pros. was wonderful, the kind of wife any man would want. I shook my head and thought, ""You have issues."" Probably if she were Caucasian he would not want to get near her for fear of catching something. After this the other stories just did not appeal to me",negative
"I am Vietnamese and I grew up in New Orleans during the 80's and 90's when the first waves were settling down there. I hate to tell this to everyone on this site but this book is the worst piece of fiction ever written. Like many books written by someone who does not belong to the culture that he writes about, the book takes great liberties with the imagination and presents the stories from the viewpoint of the writer and not the actual people. The Vietnamese characters in the book are portrayed as backwards, uneducated, and simple. Further, the stories are depressing and very few of the characters seem to have any success. If you actually grew up in New Orleans during the time that the Vietnamese Americans were setting root during the 80's and 90's, you would know that by and large, the community pulled itself from nothing to become quite successful. No real Vietnamese American thinks or acts like the characters portrayed in this book. I repeat - no Vietnamese American thinks or acts like the characters portrayed in this book. The book repeats many of the fallacies that I have noticed in other books written by predominantly caucasian male authors about East Asian Culture. There always seems to be 1) an asian prostitute 2) caucasian guy with asian bride 3) asian male in an emasculated role 4) asian people as backwards and simple. Quite sad. This book reminds me quite a bit of Memoirs of a Geisha, though that portrayed Japanese culture in a better light. By the way, the lady on which ""Memoirs of a Geisha"" is based and written about was quite upset at the author of Memoirs of a Geisha and did not feel that it portrayed her life or her thoughts in any way at all. Regardless, if you really want to find out about the Vietnamese American experience you should really read a book written by a Vietnamese American",negative
"Ok, this book IS funny, THE FIRST TIME YOU LOOK THROUGH IT!!! Overall, i would not recomend this book because it's one of those books, that you'll just look through one time, and one time only! Yeah....there are a lot of positions, but they are all repeated in the book like five times, with different names! And another thing, there are a lot of positions that are not even posible, and some only with a giant swing, or how about a horizantal or verticle pole...yeah many people have those in their houses. BUT SERIOUSLY, THE ONLY POSITIONS THAT YOU'LL BE ABLE TO DO, ARE THE ONES THAT YOU KNOW ALREADY! !",negative
terrib,negative
"Filled with bizarre generalizations, and the most pretentious phraseology I've seen in years, this book has the dubious honor of spotlighting all that has gone wrong in academic research in this country in the last 20 years. Jodi Dean shows an appalling lack of understanding of the workings of culture, history, politics, or even writing style. It seems she should have spent more time with Turabian's Manual for Writers, than surfing the web or watching Sienfeld",negative
"This is one of those books where you actually feel embarrassment for the author. The book is poorly researched, poorly written and, well, words just fail me. While I am not a great Herriot fan, I do have to give him his due - the man could write well and could tell a good story (isn't that what authors are suppose to do?) but this guy Graham Lord, I suspect, has problems feeding paper into his typewriter! The intire book is such an obvious ploy to make some money on the shirttail of a &quot;dead&quot; and popular author, it is rather nauseating. Shame on the publisher for accepting such shoddy work! I did finish the book though (thank God I did not purchase the thing) because each page became worse and worse and I could not stop, thinking with each turn of the page &quot;well it just cannot be any worse than that last page/chapter.&quot; How wrong I was! If you must read the thing, borrow it or check it out of a library. I would hate to see a person waste their money, and I certainly would not want the author and his publisher to be rewarded for a work such as this. Herriot's life, warts and all, could be such a fastinating subject. I do hope someone will turn out a good study of him eventually. We certainly did not get it here",negative
"While ""Talk to the Hand"" is inescapably mediocre in comparison to ""Eats, Shoots & Leaves"", a book I found amusing, though not up-to-par to its New York Times Bestseller status, this book does have its moments.",negative
"There is only one 100% whole grain bread recipe in this book. Most of them are less than 50% whole grain. If you want healthy bread recipes try ""Breadtime"" by Cheney or ""The Laurel's Kitchen Bread Book"" by Robertson. Every recipe in both of those books is 100% whole grain. I doubt that most people considering a book titled ""Whole Grain Breads..."" are looking for recipes that contain just a small portion of whole grain ingredients. With that being said I thought the book had some good recipes and was well written. Therefore, I am willing to give it 2 stars as opposed to none.",negative
