review_text,review_status
"Let me see how many books can I write to preach to the choir about the same thing. She must of got dumped by a handful of Liberal boyfriends (what intellegent person would want her) and now she's trying to get back at 'em. Can't wait for the next ""I hate liberals so much and here are my reasons why"" book. She should join Fox she would fit right in",negative
"Anyone with intelligence can see that Ann Coulter is not attempting to make any meaningful or objective analysis of politics. She is using inflammatory marketing to stir up the emotions of the most die-hard, flag-waving conservatives. Until this attention-seeking labeling of other Americans as 'good' or 'bad' stops, there will never be true understanding of the complexties of American politics or foreign policy by the general public. I don't agree with Bush's war and I didnt vote for him. But he's not a 'bad person'; he did not invade Iraq because he is 'evil' or 'stupid'. I can appreciate both sides of an argument; I can avoid generic categorizations. I would never watch any news, liberal or conservative, that had a clear political bias. Why can't Ann Coulter arrive at this same level of common sense? Well, she wouldnt sell as many books; she wouldnt be on TV. It has to be ""Liberals Hate America"" or ""The Conservative Nazi Agenda"". We have the duty as thinking Americans, in the most advanced free country in the world, in these modern times of massive amounts of free information, to STOP PAYING ATTENTION TO THIS GARBAGE. Get the facts and stop relying on a figurehead to spoon feed you your opinions",negative
"I remember hearing about this book by the great patriot Sean Hannity sometime in 2001, then it was a mere idea. From that time on, until August 20th 2002, I waited for what I thought would be the greatest book of all time. I remember seeing the cover art and hearing about the title: ""Let Freedom Ring"" with not just a picture of Sean Hannity on the cover, patriot that he is, but also a flag. I loved it, couldn't be more happy.",negative
"All throughtout this book Alex Delaware and his police friend Milo never stop ruminating over every new fact they uncover. They have endless discussions on how a new tidbit might fit into the overall picture. The reader longs for the pair to actually do something. In the end the author walks away without even tying up all the main strings. That is really dirty pool after making the reader wade through all the yakking. I read and enjoyed several of the early Alex Delaware books and then quit looking for new ones, now I know why",negative
"The book jacket for ""The Ruins"" offers a can't-miss premise: a group of post-grad American tourists at play in Mexico jump at the chance for a little adventure among Mayan ruins but find but then find themselves in unimaginable danger. It's the stuff of great Summer thrillers ready to be taken to the beach. But 319 pages later, the reader is left to wonder whether or not the publisher put the wrong book in the jacket.",negative
"This book was so different from the usual NR story. The burn scenes were too graphic and the rape scene was too graphic. If you want romance, skip this. It also seemed to take forever to get the book set up",negative
"This book is offensive to at least one of the two genders, though it's hard to say which. It suggests that a man whose brain was transplanted into that of a sensual woman would become a wanton harlot, more or less. Whether that's more insulting to the male brain or the female body, I'm not sure, but the book portrays neither gender realistically.",negative
"Why in the world would anyone publish a writer's bread and butter notes to his agent? Besides the money, I mean. There are a couple or three interesting fulminations against this publisher or that editor, whom Heinlein feels did him dirty. But in the main this body of correspondence is of zero interest to any but the most complete worshipers of the sf master. Just enjoy the stories, and nevermind the workaday business of how they got published",negative
"I thought it was me until I read several other reviews of Predator. Ms. Cornwell can do so much better than this disjointed mess. If she's going to continue the Scarpetta series, she needs to get back on track, creating characters that we care about. I finished this book as quickly as possible just to get it behind me. What a disappointment",negative
"I did not finish the book (I got about 70% of the way through before I realized I could not bear to read one more page). Maybe the remaining part of the book would have been better, but I doubt it. This is the first time I can ever remember not even having even the slightest interesting in finishing a book. The characters were flat and plot went nowhere. Please - there are million of books out there. Spare yourself, and find something else to read. Anything.",negative
This is an overwritten and overhyped piece of fiction that will never pass for great literature. It is timely but it is not timeless.,negative
"I thought the title was interesting so I bought this book. Wow, what a disappointment. This is sappy and poorly written. How does Mitch Albom keep getting on the best sellers list",negative
"I admit, I haven't finished this book. A friend recommended it to me as I have been having problems with insomnia. I was interested in reading a book about women's health issues and this one sounded intriguing UNTIL she started in with her tarot cards, interest in astrology and angels. Granted, I am not a firm believer in just ""the hard facts"" but its really hard to believe anything this woman writes after it is clear that common sense isn't alternative enough for her!",negative
You all like misogynist comics,negative
"despite early promise, marked by intriguing personal observations and evident self-reflection, this effort fails to deliver on the author's experience and acumen. the book is a disparate set of chapters and lacks a unitary thread, apart from a bitter leavening of asides on the shortcomings of United States rhetoric and policies on Africa. i had hoped for more, given the fine record in newsprint of this well-traveled journalist.",negative
"I read some raving reviews about this book, but I admit, I was quite disappointed. Factual, I'm sure, but it lacks details and tries to touch on too much without going into any depth. Many other pregnancy books go into further detail",negative
"The characters are uninteresting and 2-dimensional, the dialog hackneyed. I have no idea why it's on the New York Times Bestseller list. It was more of an obligation for me to finish this book than anything else. Don't waste your money",negative
"I've been following the Alex Cross series from its beginning, and after reading Cat & Mouse, I'm wondering if Patterson has taken these characters as far as they can go... Given the fact that there are 7 or 8 more Cross books written subsequently to this one, I can only hope that the series gets better.",negative
"If you are looking for a book that does a cover to cover job of bashing western civilization with complete and obvious bias, this is it.",negative
"One of the blurbs I read on the book jacket compared this book to Into Thin Air and The Perfect Storm. No way!. Those two books were edge-of-your-seat reading experiences. This account of a kayaking expedition is just plain boring. The action doesn't start until about halfway or more into the book and even then, the cliched writing and deification of Balf's subjects make this book very hard to get through. Unless you are a serious kayaking fan, I would not recommend this book",negative
"I had somewhat forgotten how Greg Bear wrote. His descriptions of the Jart are so obscure and long-winded, the reader may as well just turn the page. I found it annoying that Greg Bear attempted to invent even more words in this book than Eon. My largest complaint however resided in the high number of typos, duplicated words, letters dropped etc that made the reading even more disruptive. It really looked like there had been global replacements as the same errors were repeated. While I'd admit that an author is more concerned with flow, plot, and technical accuracy - the editor should review with a little more care to the fundamentals",negative
"I was very disapointed in the book.Basicly the writer took bits and pieces from books written by others,twisted their words and put his own spin on it.It repeats itself over and over being so repetative I had to put it down.There are good books out there written by people who were there.I suggest you take a look at those.I read many good one's but this book wasnt in that catagory",negative
"This story is very dark, full of menace and dark thoughts. Not great for kids. OK for adults if that's what you like. A hard story, not much gentleness in it except for a couple of moments",negative
"Many reviewers compared this novel to Jurassic Park, saying it was a better book than Crichton's. What absurdity. I am not saying that JP is an awesome book, but it was far better than Tyrannosaur Canyon.",negative
"First of all, I did not exactly 'read' this biography. Instead I purchased the CD version which I distilled via my car sound system every morning on my way to work (I have enjoyed countless biographies of great american figures this way, and still been able to read many more technology related books).",negative
"This simply isn't history. In real life, people do things for reasons. Historians explain what happened and (to some extent) why. That is how they are able to infer as yet unknown details and even predict future attitudes and acts. Pappe gets plenty of facts wrong, but his biggest failing is to ascribe incorrect or even impossible motives to many of the people of the region.",negative
"I know a lot of people liked this book, but I felt like it put too much pressure on me to pack on the pounds. I didn't realise so much of the book was focused on diet. It says you should plan on gaining a pound a week, and the more you gain the healthier your babies will be. Well the first 13 weeks I managed to gain NOTHING, and I felt horrible about it, but food made me so sick the last thing I could do was eat MORE food to try to gain weight. The book said that according to my starting weight I should try to gain 50 - 60 pounds during my pregnancy! I decided to stop reading the book, and so far, just going by what my gut says about what to eat and when, I've managed to put on 20 pounds. My twins are measuring perfectly and are very healthy.",negative
"Though this book does present all the necessary information for learning about abnormal psychology, it's the dryest, most aesthetically difficult to read textbook... especially if you happen to be studying the material online/through independent study. The publisher needs to redesign the book and/or you need to have a better online course professor. It feels nearly impossible to be interested in this material (which is interesting in itself) if you have to read the textbook front to back on your own without any instruction.",negative
"I bought this audio CD set at the Borders store, without the opportunity to preview the narration. Had I been able to do so, I probably never would have purchased it, let alone paid full bookstore price for it. But I needed an audiobook for my long drive the next day, so I relented.",negative
"Nothing in this book was usable for me. Okay, very little. If I was trying to write the next _Ethan Frome_, then this book would be perfect. Instead I write sci-fi and fantasy. I was looking for tips to improve my description of things; this book recommends describing different things. Too much emphasis on metaphor (which is a wonderful tool but a tad obvious). If you want to write in a way people might actually communicate, this book might be a waste of your time. HOWEVER, poets and pure-literary writers might find it more useful than I did",negative
"When I found ""Hour Game"" in paperback at our local library's monthly book sale, I thought I had hit pay dirt. But I cannot believe that this author who wrote such gripping gems such as ""The Winner"" and ""Absolute Power"" could turn out such a dog. Long, boring, and confusing. I fear that Mr. Baldacci hired an ""aspiring young writer"" to ""help"" him crank out a quick book. I cannot pass this book along to my friends -- I couldn't do that to them. It will be tossed into our blue recycle bin. What a waste. What a shame.",negative
"I was expecting this book to be a great story, but very disappointed. I cannot believe the publisher allowed the author to publish this book as it is. The book is insipid and dull, has no flow, no story, or no plot. Let me present an example. I have read many insightful Newsweek articles by a writer Allan Sloan. For example, Sloan describes a Sprint merger event in this way, ""If talk is getting cheaper, why did MCI WorldCom pay $115 billion to buy Sprint? The once staid phone companies have launched a merger blitzkrieg in an effort to emerge at the center of the wired world. Can regulators handle the complex new order....."" It has a clear logical axis, and has a force to attract readers into it.",negative
"If you are interested in a very traditional approach from a professional photographer, this book will provide lots of information. It also provides valuable tips about controlling the dog. But for my taste, I found the photographic results to be uninspiring - too much posing, too much portraiture lighting, not enough of just plain capturing that wonderful dog as it is",negative
"The worst book I've read (actually, I was listening to the audiobook). The characters are completely unbelievable and the book is so repetetive that I found myself YELLING at the tape player, ""I KNOW, I KNOW ALREADY"". I couldn't stand the torture anymore, I didn't even finish it. I have enjoyed some of DS's earlier work, but will not buy another",negative
"Was not impressed. Narrow scoped, personal reflections, applications limited. I also read the male companion book Wild at heart and was also not impressed",negative
"Ethan Mordden's editors have allowed him to ruin what could possibly have been a good book. This is the worst of his books on the various decades of the Broadway musical as the faults of the seventies book have widened into gulfs. His political ramblings (often just slightly right of Ann Coulter and making as much sense) seep through the book, dragging it down. The French people are slammed a number of times, along with the ACLU, Burt Lancaster (apparently, according to Ethan a good friend of Stalin) and the left in general, while the author defends Bush (and it does take some looking back over the page to figure out how he fits all this into a book on musical theatre). The author's train of thought wanders like a bitter old man all over the page in search of a target, any target. It is often hard to stomach. The truly sad fact about this is that the author often has quite cogent things to say about a particular musical and when he does stick to that, it can actually make one want to look at the work again. An editor should have cleaned the work up before before allowing it on stage to greet its public. The author is capable of better work",negative
The Scientific Method applied to this book:,negative
"This book was on a very interseting topic. The author took time in studying this topic. It was about the impending world oil shortage. That is the time when we, the world, will run out of oil. It tells you about Hubbert's analysis of the time or year when the world will run out of oil. They then talk about a lot of other things like where oil comes from. Then they talk about where oil is. They also talk about drilling for oil. They say it takes people over 20 drills to find oil. sometimes it will take even more time then that. Then they talk about the size of oil fields. They also reexamine Hubbert's analysis later on in the book. Rate plots is brought up because the more people driving the less oil we will have in the future. They talk about the future to fossil fuels and discuss elctricity and natural gases. They also talk about how much we already have so when oil runs out we need to think about all the stuff we already have. Hubbert was a brilliant man. some gas companys tried to make him stay quiet but he didn't want to he told everybody. The author was ver knowledgable and I could tell he knew what he was talking about.",negative
I have no idea how this book has received the ratings it has so far. I am a Lead Software Verification Engineer and am a perl programmer (for 10 years now) and found this book a complete waste of time and money. It has zero new ideas. The book tells you how to write standard tests for perl (this could have been accomplished in 2 pages). I love the format of the book. Please look elswhere if you wanna learn about perl or testing or perl testing,negative
"John Updike's literary criticism is perceptive and sparely written - every one of his non-fiction collections is worth reading. But his novels have, from the very first, been precious, over-written and stifling in their desperate need for approbation. When he writes fiction, he's like a dog doing tricks for reward.",negative
I have read all of Sandra Brown books.,negative
"If you are a Christian, this book isn't for you. It is full of blashphemy, concluding that we must ""... forgive God"" and that we must love God ""... even if He isnt perfect"". Kusher even has the will to say that ""...God would not be God..."" without our love for Him. At one point he reduces God to an aminal saying that in the garden of Eden, when God said ""...let US make man in OUR image"" he was speking to animals and creation. Kusher explains that God created the world, and in the next paragraph that we came by evolution.",negative
I was raised in Virginia and never understood the details of the Battle of Yorktown. Now I see the big picture and how all the regional events in the glorious cause fit together. Immediately after finishing this book I returned to Yorktown with an entirely different understanding. I could relive the battle as if I had been there during the war. It was fascinating! I never learned this from history books.,negative
"When I found ""Hour Game"" in paperback at our local library's monthly book sale, I thought I had hit pay dirt. But I cannot believe that this author who wrote such gripping gems such as ""The Winner"" and ""Absolute Power"" could turn out such a dog. Long, boring, and confusing. I fear that Mr. Baldacci hired an ""aspiring young writer"" to ""help"" him crank out a quick book. I cannot pass this book along to my friends -- I couldn't do that to them. It will be tossed into our blue recycle bin. What a waste. What a shame.",negative
"The setting of this book is beautiful, exotic, and interesting. The author, unfortunately, does nothing to take advantage of this. I am shocked that this book could possibly have won a National Book Award. It must mean that either the award itself is meaningless, or that there were some truly dreadful books out that year -- which I doubt. The topic of this book could have been more ably handled by just about anyone else, as far as I am concerned. I can't imagine it being done worse! Tuck's writing style -- short vignettes or episodes, one after another -- is terribly ineffective and disjointed. I felt completely detached from all of the characters. I didn't feel like I gained any understanding of who they were, and was unmoved when they died or otherwise encountered tragedies. Another thing that completely irritated me were Tuck's sexual references. Throughout the novel, Tuck would end her lame vignettes with one or two sentences mentioning some crass sexual encounter (a finger inserted in an unmentionable place or a character participating in a masturbating contest, for example). These sentences seem to be thrown in just to shock or perhaps to intrigue the reader; all they did was gross me out. They were written in such a way that they seemed to have been written by a teenage boy, not an adult woman trying to tell a compelling story. I don't know what Tuck was trying to do in this novel. I think she has failed to write anything that succeeds on any level: It is not entertaining. It is not profound. It is not educational. It is not beautiful. At only 248 pages, I can't say it was even a quick read. Utterly forgettable, once you get past the irritation of having wasted your time reading it.",negative
"No longer intended to be a comprehensive reference, the Guinness Book is now a sort of compilation of interesting superlatives with oversized pictures and many features that aren't even actual records (""Most Overrated Celebrity""). If you're going to do this, why not offer one edition that plays it by the book?",negative
"I try to read items that I would not necessarily agree with. However, this piece of doggerel is nothing but exagerrations, misquotes, and spin. She uses tacky research to make points that don't exist, then brushes off any critique as ""liberal bias"". If you are a conservative, please read something that will allow us to discuss matters. Coulters' book should be titled ""Slander: Liberal Lies I Made Up.",negative
"How can a best-selling author like Simon Winchester take an event as exciting as the San Francisco Earthquake of 1906 and turn it into a tedious snooze-fest? One answer: write as if you had just discovered an adjective mine and were free to throw in extra descripitive terms on every line until listeners scream for an end to florid phrases. Another: strive to break the record for most clich?s in a single paragraph. Finally: write about events in 1906 as if no one but Simon Winchester had ever before thought about their consequences -- thus, everything in this tedious narrative becomes about Simon. Simon and the raccoons; Simon on the failing American economy; Simon attempting to reproduce American accents. This is a CD set for avoiding",negative
"I am not a right winger whatsoever, am against our involvement in the Mid East but did read this book. I can't say it better than Alan Dershowitz who commented about Chomsky's writing in general: many people buy his books and the page that is folded down is never greater than page 16",negative
"I like Evanovich novels for a light read and a few laughs, and usually her hero and heroine are downright combustible - the Stephanie Plum and Joe Morelli relationship, sustained through 12 books so far, being a case in point. But Full Scoop was actually a trial to get through. I could hear another voice in there which was distracting and interrupted Evanovich's comedic rhythm. The whole tone of the writing was down about five notches from what I have come to expect from Evanovich. The silly villains were either being too goofy or too violent, leaving us wondering were we supposed to be amused or frightened? The least forgivable of the sins committed in Full Scoop was the fact that there was absolutely no chemistry between Maggie and Zack. None at all. So it's hard to label the book: a sort of but not really romance, an almost but not much of a woman-in-danger.... maybe a new genre altogether - the slapstick thriller",negative
"I was really looking forward to both the book and the movie. Unfortunately I think both are very much overrated. Character development is non-existent. We're supposed to believe that the haunted, passive, timid character Dave was an all-star shortstop in high school? The book had a great premise and good beginning, but went nowhere interesting. The handling of Dave's character relies on cliche and we never really get insight into the book's most intriguing character.",negative
"I am a woman and was extremely offended at the portrayel of Black men in this book and in the movie. The work offers NO BALANCE whatsoever which feels like a slap in the face. One Black male in this book could have been something other than weak or cruel. It is no wonder Spielberg was eager to take on the project and white people are going to the theater in droves. The castration of the Black male has always been their main attraction, apparently Oprah's as well",negative
"It was just that dry and boring I never really connected with any of the characters, I gave up reading about 3/4ths of the way through",negative
"Another parasite feeding off the leavings of much more substantial species. Or perhaps a more apt ocean-related metaphor would be comparing Malkin's ""work"" to that of the brainless bivalves that cluster around sewer outflows, or the mindless jellyfish who flow with the ocean currents. But like the ocean, neo-cons' writings should be taken with more than a grain of salt.",negative
I had great expectations of this book but the more I read the worse it got. For a person who is supposed to be an 'Orientalist' he sure does hate his subject. Under cover of being a scholar Lewis promotes his neoconservative ideology as serious learning. This ideology is the guiding force behind the troubles in the Middle East today. Powerful people listen to Lewis and follow his advise on how to deal with the Muslim world. Unfortunately this advice comes from a person who has made it a lifelong mission to destroy and defame the very subject he claims to be an expert of,negative
