review_text,review_status
"The color tabs really help you know what section to look at. The only disadvantages of this field guide are that it doesn't document every species in North America and that the new National Geographic Field Guide to the Birds of North America, Fifth Edition has the Blue Grouse split into the Sooty and Dusky Grouse making it more up to date!!!!!!!!!!!!!!! ",positive
"As gifted a story teller as he is a veterinarian, James Herriot has the rare ability to bring out every emotion known to the human race with a single magical flick of his pen. Every Living Thing is without a doubt one of the crowning achievements of a master, and is possessed by a single, true trait that is difficult to find in many commercial books- every single tale is told straight from the heart. You will never fail to laugh at the hilarious tales and cry at the most poignant moments. If you're an animal lover, or even just have a passing interest in animals, this is a book you will hold on to and re-read until the end of your days. Kudos, James Herriot, you are very much missed",positive
"As a long time admirer of art and a first time beginner of actually tapping my artistic well, this text is like having a private mentor guiding you through specific progressive exercises.  It's language is quaint and cozy to modern ears, having first been written in 1856.  But it is practical, clear and encouraging.  It dispells the idea that only certain people can draw.  And by focussing on drawing with pencil, it provides the foundation for using any other media.  A wonderful find",positive
"Dr. Amen has changed my life and the lives of several members of my family.  The stigma associated with mental illness is deep-seated and difficult to overcome. Understanding the root causes, particularly the genetic predisposition within families, is the indispensable first step in coming to grips with dealing with life-long problems.  These problems are often not adequately addressed via behavior modification or cognitive therapies because they get the cart before the horse:  they do not deal with the biological root causes.  Once those are dealt with, the learned behaviors and habitual patterns can be peeled away to create a whole new start on life.  However, without the understanding of the causes and types of underlying brain conditions, one is often doomed to the roll the rock up the same hill only to see it roll down again as we watch.  Take my advice.  If the brain pattern descriptions look all too familiar, get help as recommended.  You will become a new person, the one you were created to be.  And that is a wonderful thing",positive
"We have used this book as a text for discrete math courses in our undergraduate Computing Engineering and Systems program (University of los Andes, Colombia). There are a lot of advantages using this approach instead of the classical one (e.g., people really learn to prove and learn to write correct proofs). ",positive
Being a flight attendant myself and looking through the SkyMall magazine countless times on long flights I can tell you...this book is AMAZING. I have never laughed so hard from a book all my life. I really want to get another one and put it in the crew lounge. I'm sure the flight crews will get a kick out of it :,positive
I guess in this book you can see both the good qualities of Ayn Rand as well as some of her non-desirable traits.  Good gateway book before tackling on the big and long Atlas Shrugged,positive
"Pictures via camera reflect not only what the photographer sees, but what he thinks about. The most successful reflect an understanding of things as much as their image, and Jerry Thompson's exploration of the relationship between seeing and thinking in Truth And Photography provides a set of fine duotone photos to illustrate essays reflecting on working photography experiences",positive
This is the best book. I was writing a book about my son who has SI Dysfunction. He is 23 years old now. I was in Barnes and Noble looking for another book when I found this. I was blown away. I never knew there was a book like this. I could have really used this book when Marcus was little. It is so wonderful. I opened it and started reading about my son. My book is called What's Wrong With My Child? Struggling With Sensory Integration Dysfunction. It is only a mother's story of how my child coped with this thing. It is not meant to be a book like Carol Stock Kranowitz's. Her book is wonderful. Anyone who has any questions about their child who has SI Dysfunction. This book is it. Shelly R. Wilso,positive
"I love this book! It is a terrific blend of hand-holding and concrete advice for writers. Each chapter takes the writer/reader through the tough questions we face when we sit down to write: How do we begin? Where do ideas come from? Is there a ritual we can create that will help us begin? I like the fact that I could use this book as a resource. In other words, I did not have to read it cover to cover. Rather, it truly serves as a guide, a mentor's guide, that can serve me as I continue to write. I really liked the movie section,  where Cathleen Rountree uses movies to make points about the writing process.  I found those sections inspirational and useful. If you want to be a writer or if you are already writing, I urge you to Buy this book",positive
This will be a present for my nephew George's 37th birthday. He loved,positive
"I am an author and journalist and I have to say this is the best novel I have ever read. True to the word ""haunting.",positive
I think that the beginning of the book was the worst part. He started by telling us that he was leaving and wasn't going to tell anyone. He didn't even say goodbye to a lady friend. so he tells us that he's leaving and then he goes back into the past. Back when he was a little kid. He tells about different experiances. how he had to stay in bed for almoxt five years. he tells about all the troubles that his family went through. The end was the best part. i usually hate the endings but this one was good.,positive
"As other reviewers have stated, Ludlum passed away at the time of the publication of this novel. Unfortunately, we may never know what other voice has been mingled with Ludlum's to complete this tale. Honestly speaking, I believe this to be the case because the story is actually better than I have come to expect from Ludlum. No disrespect intended, but I feel this work is actually above his standard.",positive
"A well-crafted comprehensive look at the role of Islam in Turkey. The book offers some original and compelling explanations regarding the social transformation that Turkey has experienced since the 1980s. Specifically, the author mentions the role of opportunity spaces in the evolution of Islamic movements and ideas as a result of economic and political liberalization.I think anyone who is interested in Turkey, Islamic movements, and the relationship between Islam and modernity would get a great deal out of this book",positive
"Having had the delight of living in St. Andrews and traveling over most of Scotland playing golf, Allan's book is the best I have seen, by far, for describing the reality of golf, travel, and living in Scotland. He sugarcoats nothing, his opinion mirrors mine, and he is interested is ensuring his readers know exactly what to expect and know exactly how to best user their time and travel dollars. Even with my Scottish experience and contacts, his book is my golf/travel in Scotland bible.",positive
"What a great account of the nations oldest law enforcement agency.  The book is full of information about the Marshals service, it's mission, and it's history.  You'll also get to know some interesting personalities in  the Marshals service along the way. I am a Deputy Sheriff myself, as well  as a history buff.  From that Perspective, I throughly enjoyed this book  and couldn't put it down.  Mr. Sabbag, thanks for a great look into the  world of the U.S. Marshals. And as for Deputy U.S. Marshal Victor Oboyski -  I'd be happy to &quot;do a door&quot; with you anytime",positive
"this book is important for every one who has a back ""issue"".  given 5 as gifts to loved one's experiencing back pain",positive
"I ran into this book accidentally while doing some research. Instead of glancing through it, I ended up reading the whole book. I just couldn't put it off. Content wise, the book doesn't bring me many &quot;light bumb moments&quot;. However, I find it extremely well written rhetorically. While the book is easy to read, it is literarily graceful. I'd suggest everyone to read it--just to enjoy the beauty of language",positive
"This book of eight stories by Virginia Woolf shows Virginia's mind at work demonstrating her &quot;stream of consciousness.&quot; Each story flows from one thought to another asking different questions about life.  For  example, &quot;The Mark on the Wall&quot; questions the meaning of life and  existence.  &quot;An Unwritten Novel&quot; is about what people hide and  what you don't know about a person you seat next to on an  &quot;omnibus.&quot;  All these stories will make you look at life in a  slightly different way",positive
What can I say? More spidey than you can shake a stick at for peanuts. If you ever wished you had the patience to cut out and neatly collect all the Sunday paper comics in a nice neat scrap book then this is the book for you. I'm planning on buying the lot and thoroughly enjoying my strolls down memory lane,positive
"Americans who can't name five poets will name Allen Ginsberg.  In this case, that is good since he was one of America's Greatest Poets.  This book attest to this.",positive
i'm writing this before reading the whole book but its a collection of articles so the different chapters are discrete units under a common theme of the economies of the arab world with a good deal on the economies of their oil producing GCC members.,positive
"This fantastic re-imagining of the Avengers is best consumed in this form. Yes there are too many pop culture references, yes the hulk is a little goofy and the Ultimate Nick Fury has virtually nothing in common with his regular universe counterpart but I think once your done with this gigantic, thirteen issue epic powerhouse you wont have much left to complain about. This story arc takes the Alternate Universe Avengers from their creation to their first major victory, ill let someone else spoil it for you but its good. The second volume is juuuust about complete as of november 2006 and is pretty amazing as well. This is the best that the Ultimate universe has to offer, is one of the few titles exploring fairly original ideas and has not been reworked specifically to appeal to teenagers, no inline skates, teen angst, or first love in this one. ",positive
"This book provides fascinating details of what life was like for children in Colonial America: How they played, what their education was like, what they wore, etc. The information is drawn from such primary sources as letters, journals and school primers. There are a number of pictures as well. I recommend it",positive
"A very intense book on print making. A must have book for serious artists, who want to expand in their field. Lots and lots of contacts in back of book maiking it easy to find anyone you need for print making! A",positive
"I have purchased several biological coloring books in the past and use them all regularly in my 7th grade life science classroom.  Adolescents still need color and they learn as they are doing it!  This is just another fantastic resource for me to use with them.  Now that our state standards have changed and include evolution in more detail, I am certain that this will be very valuable",positive
"Good basic book, bringing back points I had been taught, and a few new to me.  Price most reasonable. ",positive
"This dark tragi-comedy resonates with the dramatic potential of Hamlet, but and edge particular to Jacobean Drama. A play which is still relevant today (many students related it to &quot;The Godfather&quot;), and brimming  with cinematic violence, lust, deception, vengence, and, with all this,  communicated through beautiful poetry",positive
Once I got super glue on my fingers and I tried EVERYTHING!! and I could'nt get it of so I got out the book and it gave me the soultion,positive
"According to Charles Kimball, religion is the most powerful and pervasive force on earth.  Religion inspires humans to transcend their self-interests, while at the same time, more evil has been committed in the name of religion than any other human institution.  Using a comparative religious approach, Kimball uncovers five warning signs that increase the likelihood of a religion becoming unhealthy or evil.",positive
A wonderful book. You will meet many charming cats on your jounrey here that will stay with you forever. ,positive
"Arrogance by Bernard Goldberg is a truly enjoyable read.  Goldberg doesn't waste time trying to create a vast left wing conspiracy tied to Islam or Communism, he just presents the facts as he sees them.  As a former insider, he's got the dirt on media bigwigs, and he's not afraid to dish.  The liberal bias in the news is causing many people to flee the big three networks and turn on cable to find an escape.  Goldberg offers up several examples of this bias and then goes further by coming up with several suggestions (some tongue in cheek) for correcting this slant.  He also includes surprisingly frank interviews with Tim Russert and Bob Costas.  Goldberg's other books Bias and 100 People Who are Screwing Up America are also excellent reads.  He doesn't attack people on a personal level (although you can tell he has a bit of a grudge against Dan Rather) or use hyperbole or vitriol to get his point across.  Some books written with a conservative slant make you want to throw up your hands and give up on this country, but Goldberg's books don't have that effect.  You can tell he not only loves the country he lives in, but also the profession that he's chosen, and he has hope for the future. ",positive
I have to say that this book is fantastic- step by step photographs for each garnish.  I just made a crab out of a cucumber in 5 minutes! ,positive
This was an amazing read. I couldn't put it down.,positive
"I've read a lot of books on real estate sales, but this books is my favorite. Jim Remley offers comon sense ideas that are easy to implement and are being used by real agents. Everyone should read this book.",positive
"Why read a book from 1857 which flopped so badly as commercial literature that Melville stopped writing and ended his career as a customs official? Because this book masterfully explores the entire nature of trust, confidence and cons. Though the setting is a riverboat on the Mississippi River just before the U.S. exploded into Civil War, its insights cross cultural boundaries. ",positive
"I decided to read this on a flight to Indiana from NY.  I managed to complete the book on the return.  It is a quick read, not a self help book, more about Merton and Nouwen finding their true self as well as the author's road to becoming a Jesuit.  I think we all want to find our true self, but not all can and some never attempt to.  Martin stresses the importance of finding our true self in order to achieve happiness that comes from within",positive
"The title of this book is rather deceptive in that you certainly don't need to be adventurous or daring to find this book helpful.  I do sedate landscapes and found his book an excellent guide.  Basically, if you do the least bit of original design in your work - altering an element or two, changing colors around - or if you do whole original works (but haven't actually gone to art school) this book is extremely useful.  It covers the basics of design and color with a focus on the embroiderer or fiber artist.  You can do all the suggested activities in the book in order as a complete design course, or pick and choose sections as needed.  If you wonder why some of your works look great and others look, well, not as great, this book is for you",positive
"Thirty five years ago my high school (Thomas Jefferson, in Federal Way, Washington) held annual competitions in mathematics.  They did it in the form of a test that came bound in a small white booklet, just was a few pages long.  There weren't many questions, perhaps a dozen or two (usually in the form of story problems), but they required deep thought and concentration (at least for me).  I still remember the feeling of excitement and trepidation as I took the ""white book"" and opened it to the first problem.  Several hours later I'd consider myself accomplished if I'd managed to completely answer more than half the questions.  ",positive
"Of all of Willard's books, this one was my favorite.",positive
I work for a dept. with the state government and Grote's comprehensive performance management system was implemented several years ago. It works. Takes the indecision and inconsistency out of perform. mgt. This text is excellent. I found that it was easy to read and to apply. We also use Grote's Discipline Without Punishment (DWOP) system also. I recommend his book of the same title also. Excellent system.,positive
"Never Be Sick Again offers a major breakthrough in medical thinking regarding health and disease.  I am a biochemist doing medical research at UCLA. A friend gave me this book to read, and I was very skeptical.  After reading it, I couldn't stop thinking about what it was saying.  I even lost sleep thinking about it.  After many weeks, I have come to a conclusion - the author is right.  There is only one disease and there are only two causes of disease - revolutionary!  Once you understand this simple concept, it changes everything.  If your mind is not closed to new ideas, the profound insights in this book will change your life for the better.  It will give you the power to both prevent and reverse almost all disease.  With this new understanding, from now on, I will approach my research in an entirely different way.  ",positive
i learned a lot about this history. was useful for the papers that we had to do in class,positive
"My daughter at U of M got me interested in the Rwandan crisis and was just vacationing in Canada and picked up this book by a Canadian General who was leading the UN effort in Rwanda during the genocide and what a tragedy this  was and remains. I didnt walk away thinking this guy was a great General but he had the guts and the commitment to right to stay in spite of the ineptitude of the United Nations and Cofi Anan who was in a key role at the time. The tragedy of what the free world stood by and let happen is nearly unsurpassed, probably only by the Jews extermination in WWII. If you have any interest in the world happenings and think you have faith in the United Nations just buy this and read it - we need change.",positive
"I love these type of memoirs. A person who is not boasting about their skill or having an attitude. Simply shares the love of his work and love of his county. All of James Herriot's books are wonderfull. I was introduced to the children's books a few years ago and just recently started reading his memoirs. Love it, some parts were a bit dry but the books still flowed well and drew you back. Love the depth of scenery and anicdotes about the area. Recommend any book of his",positive
"Expect everyone to maintain a peaceful hush as you read this book aloud. A sense of serenity permeates through the words and is perfectly matched by the illustrations.  The imagery captures your senses and the story pulls at your heartstrings. Grandfather Twilight is an endearing character that makes you feel warm and safe. This wonderful book is sure to appeal to all ages (preschool to an older adult).  And, it isn't just for bedtime either.  ",positive
I've had this book since 1997 and I still refer to it for ideas.  It has such a unique and diverse pictorial on each page by 'grand' and 'credible' photographers.  For anyone who takes pictures...likes pictures...this BOOK is a MUST GET for you.  I have it on my coffee table and I get rave comments on it all of the time about what a GREAT book it is,positive
My 8 year old daughter brought this book home from her school library and was excited by many of the projects. From a parent's point of view it was great to have a book with achievable craft projects which yield items the  child can be proud of and parents will happily display. I'm ordering it  now,positive
"When I was 21 and in my first year of graduate school, Paul Fussell's &quot;Poetic Meter and Poetic Form&quot; was one of the first text books assigned to me. When I bought the book and saw how slim it was, I snickered, &quot;Grad school's gonna be a walk in the park!&quot; ",positive
"This is Ann Waldron's best McLeod Dulaney mystery yet. The characters are so lively and well-drawn they literally walk right off the page (and, in some cases, right into your heart). The setting--the Princeton Theological Seminary--is perfect (a perfect place for a murder, that is), and the plot is downright diabolical. Are you in the mood for some humorous, mysterious and sinfully well-written fun? Then do yourself a favor and read this delightful book",positive
"i am currently in psychology for the third time,(due to it had been too long between college classess) i think the book is informative and not too hard to read (if you have too!",positive
"A pathbreaking work in women's history and the history of deviancy, this book argues (if not entirely convincingly) for a new interpretation of the history and relationship of girl delinquents and women reformers. Odem  traces the history of middle class women reformers towards sexual  delinquency by young girls through the particularly rich case history of  Los Angeles County. Noting the diverse cultures in L.A. (white, working  class, Hispanic, African-American) Odem argues that many girls who became  labeled &quot;wayward&quot; were acting out against oppressive and  repressive families who held old-fashioned and patriarchal views of girls'  sexuality. Odem also explores the eventually oppressive route that  reformers took in &quot;retraining&quot; wayward girls",positive
"This is the best invertebrate zoology textbook on the market, perhaps the best ever written. The authors are not content to merely present in fine detail the classification, anatomy, physiology, behavior, and ecology of invertebrates, they present alternative interpretations and controversial opinions where these topics are concerned. In that way, invertebrate zoology comes alive as an active, important, and relevant field of study for understanding the ecology and evolutionary relationships of these organisms in a global setting. I highly recommend this book for a course of study or as a reference for Earth Science instructors who wish to solidify and deepend their knowledge and understanding of invertebrates",positive
Peck relates growing up in rural/small town Vermont with a best friend who gets him into lots of trouble. Humor and pranks abound in between lessons learned,positive
"This cookbook has become one of my favorites. I grew up in SE Texas, and once I moved away, no mexican food could compare. Now I have the understanding on what differeintiates Tex-Mex and Mexican food. The recipes are exact and delicious. I love the pictures, the stories and most of all the inspiration to cook my favorite meals! Its definately a book for any Tex Mex lover, I highly reccomend it. Just try and sit and read it and not have your mouth water",positive
"This massive volume encloses most of the major theorists in criticsm and theory, this book is essential reading for Literary theorists and those people who are interested in reading the original texts of the greatest thinkers in history",positive
"This is for sure a great book, if you have the ability to concentrate for more than five minutes, unlike the majority of the Herd, in mean people, of today.  If your intrest lies in the substance of this book, read some other review, I'm only going to tell you that, the (1909) publication, stinks; the so called book, is more like a oversized magizine, and the print is about the size of a footnote in the bible",positive
"I took my last science course about 40 years ago and had forgotten how interesting science can be. This book is not light reading and some people will probably not get past the first few pages but I really enjoyed it. I found tons of new information on mushrooms in spite of the fact that I studied mushrooms in college (until my father decided science was not for girls and convinced me to go to Law School. Yep, those were the good old days.) You will enjoy it as long as you take into account that it is a scientific book, perfect for geeks",positive
"Another solid text from our friend Sensei Demura. This is part of his popular set on Okinawan Weaponry and well worth the cost. Portrayed in the book is weapon history, basic stances, grips, blocks and strikes. Demura also covers self defense applications against many various attacks. For all Karate and Kobudo students I would reccomend this book",positive
"I will start this review by noting two things. I greatly appreciated Nussbaum's 'Upheavals of Thought', and I am uncomfortable with the way sex sits in the society I live in. (But, then, I recognise things in myself that - for good or bad - change my perspective from that of the society I am embedded in.) But Wedekind's play 'Springtime Awakening' should raise alarm bells for most of us. ",positive
