review_text,review_status
"Bridget Jones, modern day woman, brillant and doesn't know it, prone to accidents and mess ups but manages to come out of them.  ",positive
"I am ordering copies for all 23 middle school principals and the two assistant principals leading two middle school programs in the Milwaukee Public Schools system. We will use Wheatley's book as the primary resource  for our professional growth at our MPS Middle School Principals  Collaborative institute August 9-11, 1999. We are not just concerned with  reform; we seek renewal as well. Wheatley provides the basis. She notes  that Einstein said that  a problem cannot be solved from the same  consciousness that created it. The entire book is a marvelous exploration  of this philosophy",positive
"As a casual piano player and a Broadway fanatic, I was so jazzed to play some of the songs from Avenue Q. The book contains everything you find on the CD and includes a few production photos.",positive
"This is one of the best biographies I have ever read. You can tell the authors put a lot of time and effort into this work - it's a true labor of love. Filled with beautiful photos and extensive bibliographical notes, this one is a keeper. Who knew Miss Francis was such a ""wild child""? Whether you're a film scholar or a movie buff, Lynn Kear's book deserves a special spot in your bookcase.",positive
"I read this book many, many years ago on a very long flight.  I couldn't put it down.  The philosophy is simple; live frugally, save/invest money every month, and you too can be a millionaire.  It's great advice, especially in this day and age when the younger generation wants the big house, expensive car, and everything else right NOW, with no regard to the future.  Although some of the info is dated (Enron being named as a great company to invest), and some other advice (putting new soles on old shoes) is a bit much, the general message makes plenty of sense.",positive
"This book was someone else's bookclub selection, and I think having no expectations when I picked it up really helped in my having that WOW experience that some folks report with this book and others miss. Yes, the prose needed much better editing: overuse of repetition, ""stock"" phrases, and ""hanging"" assertions that should have been cleaned up.  However, I found the discussions of brain development/evolution, similarities between certain animal behaviors and human behaviors, development of language in different animals, and the coevolution of humans and dogs to be facinating (oops, just gave away the ending!).  I found the side discussion of outcome-based audits interesting and enlightening.  I also liked Dr. Temple's recommendation that people with autism be hired for baggage checking positions.  Great idea! Although the book really goes all over the place, I found it a wonderful opportunity to engage my ""seeking/hunting"" motivation (you'll have to read the book for that one), and worth wading through the flaws to pick up the nuggets of gold",positive
I have been studing leadership for over 15 years both by reading and experience.  I consider this book to be the best book I have read because it describes leadership as a learned activity.  It also says that leadership is in motivating people to do their own work in solving difficult problems. I found that as President of my congregation I was continually going back to the concepts in the book to lead it through a very difficult situation involving placement of the flags in the sanctuary.  It was very difficult to get people to do their own work and not try to step in to solve everything. (That would have been impossible anyway) I found that he described President Lyndon Johnson as a successful leader (civil rights) and unsuccessful leader ( Vietnam).  His discussion on leading without authority is new ground for me.    If you want to discuss the book with others there is an on-line book study at the Work and Worship Institute website. I found it was a good way for me to get more from the book. This is a great book with great stories of a variety of leaders in our society. ,positive
The best book on the history of World War II that I've read in a long time. ,positive
*** REFERS TO CD RECORDING ****,positive
Zadie Smith is one of the most powerful authors I have read in recent times. She is so subtle about the race factor that we don't get to find out the races of the protagonists till the first 50 pages or so. She has also captured the emotions of Kiki and Zora perfectly (why is it that women always stand out in emotional moments!) and the characters stay with you even after you put the book down.,positive
"I've been very critical of the fiction work of John Grisham in recent years and have said many times that he needed to take more time to write his novels to make the stories more interesting.  Well, he has taken time off of writing novels to write this interesting, if not spectacular non-fiction work of the trials and tribulations of Ronald Williamson, a former minor league baseball player implicated in a murder and sentenced to death row.  I won't go into the details of Williamson's ordeal, but I will say that Grisham has written a pretty cut-and-dried book, that probably would have been handled better by career crime writers, but is still interesting nonetheless.  He does a good job giving the details of Ron's case and what he and his family had to go through as events unfolded and Ron suffered from growing mental issues.  Grisham didn't even think about writing Ron's story until after Ron passed away, so there are no interviews to draw upon, but he does a decent job of tying it all together.  I will also say that although he is anti-death penalty, he doesn't hammer that opinion at you.  He lets the story itself do the talking.",positive
"Zig Ziglar has done it again. As an author myself of sales books,  I realize sales is about so much more than just having the 'gift of gab,' and fast talking. It's about asking the right questions and listening to the right answers. It's about not just being a consultant to others, but being a consultant to yourself. It's recognizing you are in the most honorable profession there is. Zig's theories exemplify this.",positive
"A quick search in Amazon books under the name ""Benjamin Franklin"" comes up with 2403 matches. Based upon that criteria, many people would say that everything that could be said or that needs to be said about Ben Franklin has been said.  Those people would be emphatically wrong, as has been proven by author and historian H.W. Brands in his work on Franklin, THE FIRST AMERICAN: THE LIFE AND TIMES OF BENJAMIN FRANKLIN. Brands expertly brings this pivotal figure in American history, back to life, once more, in this book which was a Pulitzer finalist in 2002.",positive
"I didn't discover the delight that is the Artemis Fowl series until a week ago, when I read ARTEMIS FOWL in one day.  So, of course, I had to pick up a copy of THE ARCTIC INCIDENT right away, to see if it was as good as the first.  It definitely is, and in my own humble opinion, I think I liked it even better than the first book.  There are points throughout the book where Artemis, now thirteen, shows a softer, more vulnerable side that I truly enjoyed.  Don't get me wrong, he's still an evil genius, but he's an evil genius with heart, and you can't help but love him.",positive
"   While I am only a high school Sophmore, and I don't have a *real* job, this book has been very helpful in deciding what to shoot for doing. I've heard people call this book too vague, but they can't tell you exactly what to do; it doesn't work that way. Once you get through the personality quiz portion, the author gives a somewhat detailed description of your specific personality type (I for example am and ENFP) and throws in suggestions in the description and also give a modest list of other possibilities. I'll admit it was a bit vauger than I had hoped but it gives you plenty of room to move around and a great place to start. ",positive
"Beautiful, stunning absolutely gorgeous.",positive
I loved this book. The food was really good and fast (which is good because I have a very packed schedule). Also great if you're on a budget. The recipes have variations so I could eat different things but not have to buy a whole new set of ingrediants.,positive
"The NY Times Book Review linked this novel to the aftermath of 9-11, but that may have more to do with the preoccupation of New Yorkers than with the story Powers wrote. While he does refer to 9-11 early on, this book concerns environmentalism and species conservation versus wrong-headed economic development in the Great Plains at the western edge of the midwestern farming belt. It is about the struggle not to loose even more economic ground relative to the rest of America in a region that is being slowly drained of its population due to the changing scale of agricultural operations. But since it is a Richard Powers novel, it is also about much more: neuro-physiology, brain function as reflected in behavior and personality, the devotion of a 30ish sister to her less-able younger brother, her sexual relations with two very different men, and a nationally-known writer (clearly modeled on Oliver Sachs) who has a late mid-life crisis. It is about love, devotion, and doing as much of the right thing as one can do. It involves escape and return. ",positive
I must say my first reaction was to be surprised at how much better Hawking is at explaining modern physics than my college instructors were.  Heisenberg's uncertainty principle was just an equation I learned.  Hawking made it seem like common sense.,positive
The journal format is a unique take on the genre and I especially like the detailed attention given to gear and survival.  The author obviously knows his stuff.  What's also impressive is that this novel is self published.  I'm surprised someone hasn't taken notice and offered J.L. Bourne a deal.  He's good,positive
"College stoner cult following aside, Hunter S. Thompson's journalistic prowess was a vital national resource up until he left us last February.  Thompson was one of those brave few who dared to cut through popular media perceptions and glittery rhetoric and travel right to the ugly center of his subject material, counjouring hilarious allegories where the average journalist would already have soiled himself in disillusionment.  ",positive
"Bob Quinn is definitely one of the most profound writers on change in this era. But his work is not for the faint of heart because he challenges each of us to start change initiatives in the place we'd least like to go -- inside ourselves. I found this an incredibly powerful book. I've used sections of it with my ""change management"" classes for several years and I know it has a tremendous impact on students, who like most managers have grown up unconsciously believing that change always needs to start with the other guy. If you want a simple formula for change, don't buy this book. Although it is full of practical, actionable ideas, ""Change the World"" addresses change at a profound level that asks readers to reflect seriously on what they stand for. It's a very difficult but rewarding assignment",positive
This is the BEST book written by Stephen King!  I've read it twice and will probably read it about ten more times before I die,positive
"I in 1996 I bought and read All the Pretty Horses first. Laughed myself off the train seat in to town.  Bought the whole lot and read them in chronological order - re-reading Pretty Horses on the way.  Along with scenes from the Orchard Keeper, Sutree sticks in my mind - images ideas, flavours, jokes, and a personality that I'd rather see more of.  Sutree made me feel that I know this man, and could even like him.  Great fun, and deserves selfish time to read and unwind after reading.",positive
"I'm way over the age of 13, but I just loved this book.  Interesting story and characters that I enjoyed spending time with",positive
Great story!!  Excellent in fact.  My beef is with the narrator and editor:,positive
This book is NOT about ALL people. It is about gifted (in this case that means sensitive) children that are misused to feed their parents narcissism. Most children are not that sensitive and hence not suseptible to that specific abuse.,positive
"This is an extraordinary biography for, while Blumenson's admiration for George Patton is evident, it brilliantly illustrates all the sides of Patton's personality - both positive and negative. The book truly goes  beyond the popular perception of the General -and far beyond the movie- in  exploring his character and motivations. Not an overly long book, but  thorough, detailed, and very enjoyable to read",positive
"Gibbon's ""Decline and Fall"" is without a doubt one of the most well-written and truly comprehensive historical works concerning the Roman Empire.  From the military maneuvers of the northern legions to the intrigues of the Imperial Court, Gibbon showcases the history of Rome as it unfolded--often relying on the eyewitness testimony of contemporary writers to give readers a sense of the passions and policies of the time.  There are a few minute problems--or rather gaps--in Gibbon's work, but given that he originally published in the late 1700's we can excuse his lack of complete information.  Overall, an excellent read and a great history of such an important subject",positive
"I have probably close to a dozen or more people I know, including myself, that have read this and had great results removing all sorts of chronic symptoms.",positive
"Because the ideas and strategies really work! Robert Allen gives more concrete information, real meat if you will in one chapter than these other so called financial authors do in an entire book.",positive
This book gives a thorough analysis on how public policies were the catalysts for the socioeconomic destruction of low-income communities of color in New York City. Necessary reading for those who still do not  realize that activism and organizing are important vehicles through which  marginalized communities keep in check the forces that seek to further  fragment and disenfranchise them,positive
"Patriotic terrorist fighting storyline.  Exposes the political games played in Washington, that many times put our military in dangerous situations.  This book inspires me to patriotism and also deep gratitude to the Special Forces men who are so brave.  I know the book is fiction, but I can't help but feel that it is more truth than fiction.  Mitch Rapp's wife Anna is getting a little hard to stomach.  She is a good example of how an aggressive woman can nearly neuter a strong man. Again, hard to recommend to absolutely everyone because of the explicit sexual situations.  I hate to encourage my teenage boys to read it, although 95% is absolutely wonderful and inspiring, portraying men as REAL MEN. ",positive
"Since 1965 I've taught this ""truth"" based upon metaphysical studies.  Now, at last, there is scientific evidence supporting the fact that EMOTIONS CREATE FACTS",positive
"Having read most of Grisham's books, I've saved a few of his ""best"" for last.  While it wasn't a 5 star book like I'd hoped, it certainly was one of his better books with a lot of detail and of course the plot was an interesting one.",positive
"Tom Friedman's writing style is easy to read and his overarching concepts-webs and walls; states v. markets v. individuals; and the comprehensive failure of the Arab street, leadership and Muslim clergy to combat the really tough and valid questions of the day-are extremely well thought-out. From reading this compilation of NYT columns, I understand where Friedman conceived many of his ideas for his current best-selling book, 'The World is Flat.' Although I sometimes disagree with his opinions, his ability to see the big picture is spot on",positive
"I bought this book just recently and was really touched (and cried) by the whole experience that Gus had went through. He has lost the one friend that gave him a second chance (Stephanie) and without her, he could've been out there on the street again. Overall, it's a good book to read and I always believe that man and animals can be best friends and learn from one another, this book is a genuine prove.",positive
I read these books just for fun thinking I would finish in a few days and not think about it past that. Well I had another thing coming. I couldn't put the book down once I had started. I missed hours of sleep because of these books. If you want a book that can keep you enraptured for hours read the Artemis Fowl books you won't regret i,positive
"Great heartwarming stories about a boy, 2 owls and a dog.  I recommend this for all ages.  The cover markets this as a childrens's book, but adults who like animals will love this story too.  A bird lovers' delight",positive
This cookbook is the best in my collection - and I have a lot!! The instructions are clear and the pictures are great,positive
Arrived on time and in terrific shape! Thanks,positive
"Ever since starting on the SIMPLE ABUNDANCE journey with Sarah Ban Breathnach's first book, I have longed for an opportunity to learn one-on-one from the Queen of simplicity and authenticity. We may not be able to meet Sarah face-to-face, but now anyone can enjoy a workshop  atmosphere in the comfort of her own home. Women caught up in the  day-to-day deluge of deadlines, appointments, and commitments can now curl  up with a pillow and excavate their authentic self. I highly recommend this  book to anyone who wants to savor their life instead of living in a blur",positive
"Tina Dirmann did a fantastic job writing about this difficult case, which encompasses motherhood, mental illness, child abuse, and matricide. Dirmann does not interject her own biases or agenda into her writing, rather she presents the many different angles of this story in a compassionate fashion. That, in and of itself is impressive, because many writers of true crime tend to lean one side or the other,get caught up in emotion, and appear unable to really present all sides of the story. Lessons can be learned from this book regarding mental illness and society's responsibility to help families who are in need of intervention. It is so sad that the extended families of these boys failed not only them, but also tragically failed their mother.",positive
Very topical. Easy read. Hope people in the know read this and give serious thought to the potential for something like this happening.  Gives good reason why border control should be taken more serious by everybody. Looking forward to reading other books by Mr. Bell,positive
"With every Grisham book I read, I get more and more impressed with his ability to not only use the law to create suspense, but to insert other elements to make this human as well.",positive
"This book, Styron's finest, is about redemption.  Heralded by the epigraph from John Donne, the intricately structured tale with its Marlowian manipulations of narrative points of view soon becomes so enthralling that  it's impossible to put down.  But it's also to Styron's great credit that  the novel's theme, redemption through confrontation with death and  violence, is reflected through its feverish style.  There are not many  books in the postwar era, and none in the United States, that have such a  non-moralistic but intensely moral character and impact.  Echoes of the  Greek tragedians (several times evoked in the text) and of Dostoyevski  abound.  Finally, the crucial role by the most-fleshed out non-expatriate  character, a philosophical Italian small-town cop named Luigi, elevates the  moral drama to a metaphysical dimension that most contemporary writers  don't even seem to understand, let alone approach.  It's a shame that  Styron has not received the Nobel Prize yet",positive
I read the good Doctor's book Eat to Live and then bought China Study which he talks a lot about in this book.  Then I bought this book being curious after reading a few other books on fasting and this book wins hands down though I do feel he's being overly cautious about doing long fasts of more than 5 days without medical supervision to protect himself as people have been doing long fasts for centuries without medical supervision and doing just fine and since finding a Doctor in even a large community is rare indeed one is left to do this on their own.  ,positive
"From the beginning of Ruby's story, through all the footnotes of life, to the burying of Bunty...we live four generations of the Lennox family.  This is not your average family, people disappear, mothers leave families, children die in mysterious ways.  ",positive
"Very detailed information about Hypothyroidism, Can help anyone with a low basal temperature. If you think you are hypo and your doctors won't help you read this book and you will find a doctor who will help you. Lots of knowledge about this condition. Must read",positive
"This book gives the reader a fascinating and personal look inside not just the foster care system, but why they are very much so needed.  Young Dave's life was very likely saved by being taken from his mother's home and placed into foster care.  But this book makes it clear, that despite this positive change in is life, it certainly didn't mean everything was ""happily ever after"".  Dave then struggled with issues ranging from not knowing some of the mere basics that other twelve years olds know by that age, ranging from as simple as how to take a proper bath to how to behave with proper manners.  It also gives you a good look at the struggle these hard working foster homes and parents go through.  They deal day in and day out with children coming from troubled homes, and these foster homes are in such high demand that they end up cramped to the brim.  I think many of us, myself included, are unaware of just what a struggle it is for both the foster children and the foster parents, as well as how much we need to support these people.  They are dedicating themselves to a truly needed and wonderful cause.",positive
Neverwhere is one of Gaiman's best yet!  I highly recommend this novel,positive
"I expected this to be dry and mechanical like lots of other math texts - too-technical proofs, homework questions irrelevant to the material, insufficient explanations for why things are the way they are. This book really surprised me because it wasn't ""mathy"" at all. It doesn't just throw proofs at you expecting you to wade thru page upon page of math notation until you understand - it gives you the intuitive side of important concepts, which means you only need common sense, not an intensive mathematical background to get everything. The examples they picked simplify rather than confuse the concepts. Each easily and naturally leads to the next. If there's anything not thoroughly elaborated, they were sure to cover it in the homework questions, by gently prodding the reader along towards the answer step by step instead of smacking them in the face with impossible problems. Homework questions supplement the material perfectly and basically leave you with a full and well-rounded impression of what the concepts mean as well as when and why to use them, not just how to plug numbers into some formula.",positive
"I really enjoyed this coloring book--as in my very early yrs., I had kaleidoscopes to play with.  I was always intriqued with the color spectrum in them.I was hoping to find more on line with the illustrator of this book.  Sadly disappointed.  Will keep looking at other book sites. By the way, I am 56 yrs. old--and I love to color.  It's wonderful therapy for relaxing and bringing back some childhood fun",positive
"This was the first sales book I ever read. And today, 10 years later, I have it proudly displayed in my library. When I speak with clients who I now teach sales skills to, I still reference it from back in my days selling copiers in 1994. Way to go Stephan!",positive
"If you like math, I guarantee you'll like this book! The author starts out with some very nice infinite sums from 17th and 18th century mathematics (Newton, Leibniz, the Bernoullis, and Euler's Gamma function). He continues into the 19th century with Riemann and Lebesque integrals, Weierstrass' pathological functions, Cantor's set theory, and winds up with Baire's category theorem.",positive
"Painstakingly compiled by Judy Brown (contributing writer and comedy critic for LA Weekley), The Funny Pages is an impressive and hilarious collection of 1,473 jokes gathered from the funniest modern-day comedians around, ranging from Robin Williams to Bill Cosby, George Burns, Conan O'Brien, and many, many more. The individual jokes are arranged by topic underneath dictionary-style headings. From Alcohol to Yoga and Zoos; each gag is short but sweet, and packs a punch in this chuckle-inducing, highly recommended anthology of wit, gags, and humor both classic and cutting edge",positive
"Brilliant. Sam Harris portends the calamitous pathway that irrational, divisive thinking (religious & secular) will cause. He also spells out the necessary suggestions and goals for humans to evolve to the point where we're globally not at risk of suffering due to anachronistic prejudices",positive
This book turns the entire concept of intelligence inside out. Seriously mind-blowing. Excellent exercise in extended mental gymnastics. You won't be disappointed,positive
"This book clearly, easily teaches the 5 different ways we each relate to one another.    It is applies very well to couples; however, the principles also provide essential insight into relating with children, colleagues... anyone!  It makes an excellent group book study or a read-on-one's own",positive
